{
  "schema": "nocturne.pins.v2",
  "product": "knot",
  "network": "testnet",
  "tier": "own",
  "contracts": {
    "knot-registry": {
      "layer": "duskds",
      "id": "29db8e8eedd70bb42fe477131ca967069e2e641a0c0411ebf7f8ae2de0e9e731",
      "version": "0.2.1",
      "tx": "a096e8fa0c0cd0af12a552614d12696430ab56e722631ae5d3351c917ff3f95c",
      "at": "2026-10-28T14:29:50Z",
      "record": {
        "version": "0.2.1",
        "contract_id": "29db8e8eedd70bb42fe477131ca967069e2e641a0c0411ebf7f8ae2de0e9e731",
        "tx_id": "a096e8fa0c0cd0af12a552614d12696430ab56e722631ae5d3351c917ff3f95c",
        "wasm_path": null,
        "dd_wasm_path": null,
        "wasm_sha256": "046793f59d87f893e91a974b52a30058e7fcc67685dfb43f620dfd02b11c5359",
        "deploy_nonce": 1793197775,
        "address": "zoMdB5Bs5DGrnsALy2NagpHZi7kgzp1dYCcTS43bjBPC2i8zrDaLjKk6Z4WEMjBcDTFr6sZHuLoHKXehkMwVJMhVMWTdGTyvRf3tU4pfwuuePSkRrBQn75v7Lvv9CrmkgYX",
        "deployed_at": "2026-10-28T14:29:50Z"
      }
    },
    "knot-proposals": {
      "layer": "duskds",
      "id": "3539ba8dc769929c4deef920af74e00ddce98aa67d419c3fc4bb927d7c6fdeb5",
      "version": "0.4.0",
      "tx": "c21a56ce3a771adc8301270181b48b294153a91b49e873e9f9fdd8340bc91e44",
      "at": "2026-10-21T07:19:06Z",
      "refs": {
        "atlas": "atlas/atlas/testnet/own"
      },
      "record": {
        "version": "0.4.0",
        "contract_id": "3539ba8dc769929c4deef920af74e00ddce98aa67d419c3fc4bb927d7c6fdeb5",
        "tx_id": "c21a56ce3a771adc8301270181b48b294153a91b49e873e9f9fdd8340bc91e44",
        "wasm_path": null,
        "dd_wasm_path": null,
        "wasm_sha256": "d272efdd6ff88c02980dd2951aa8d0637429dad2e8c847eec8a2edab60a79361",
        "deploy_nonce": 1792567128,
        "address": "zoMdB5Bs5DGrnsALy2NagpHZi7kgzp1dYCcTS43bjBPC2i8zrDaLjKk6Z4WEMjBcDTFr6sZHuLoHKXehkMwVJMhVMWTdGTyvRf3tU4pfwuuePSkRrBQn75v7Lvv9CrmkgYX",
        "deployed_at": "2026-10-21T07:19:06Z",
        "atlas_pin": "fd2b8594031d56ae584301976e26f7348aaaea3a9900d2967201789f1b4e4ce9"
      }
    },
    "knot-registry-data": {
      "layer": "duskds",
      "id": "03734f3c300b75e81e79e4e497791ba794fb5537586ec8eb96d0191f634b8c82",
      "version": "0.1.0",
      "tx": "23677639806a3c000ce8a8e70d8c762368191e0f36c002d81d4c30ed10459846",
      "at": "2026-10-28T14:26:30Z",
      "refs": {
        "atlas": "atlas/atlas/testnet/own"
      },
      "record": {
        "version": "0.1.0",
        "contract_id": "03734f3c300b75e81e79e4e497791ba794fb5537586ec8eb96d0191f634b8c82",
        "tx_id": "23677639806a3c000ce8a8e70d8c762368191e0f36c002d81d4c30ed10459846",
        "wasm_path": null,
        "dd_wasm_path": null,
        "wasm_sha256": "6766d4fe0042d6ea01cf708f5ba9efe560225b52f0be31a4496cf65a01487c91",
        "deploy_nonce": 1793197575,
        "address": "zoMdB5Bs5DGrnsALy2NagpHZi7kgzp1dYCcTS43bjBPC2i8zrDaLjKk6Z4WEMjBcDTFr6sZHuLoHKXehkMwVJMhVMWTdGTyvRf3tU4pfwuuePSkRrBQn75v7Lvv9CrmkgYX",
        "deployed_at": "2026-10-28T14:26:30Z",
        "atlas_pin": "fd2b8594031d56ae584301976e26f7348aaaea3a9900d2967201789f1b4e4ce9",
        "dd_wasm_sha256": "7ec48e25b0abe2ae99b91ad9814331be006ad560f1ddb33e99a6173150ff363a"
      }
    },
    "knot-proposals-data": {
      "layer": "duskds",
      "id": "d855030c4e3826fd035b99eaa63b028f1d0b936bd7491461c404f3f7feb54436",
      "version": "0.1.0",
      "tx": "5a5a003490601d19d4d1ae3c3e50f0a2b5a5146b8da3647c0c2e47768e9f620e",
      "at": "2026-10-21T07:18:46Z",
      "refs": {
        "atlas": "atlas/atlas/testnet/own"
      },
      "record": {
        "version": "0.1.0",
        "contract_id": "d855030c4e3826fd035b99eaa63b028f1d0b936bd7491461c404f3f7feb54436",
        "tx_id": "5a5a003490601d19d4d1ae3c3e50f0a2b5a5146b8da3647c0c2e47768e9f620e",
        "wasm_path": null,
        "dd_wasm_path": null,
        "wasm_sha256": "2d4d5df52f339388d395c7afbfb1a95c7d2a76c46fb3a938de9e5374b9c881ef",
        "deploy_nonce": 1792567106,
        "address": "zoMdB5Bs5DGrnsALy2NagpHZi7kgzp1dYCcTS43bjBPC2i8zrDaLjKk6Z4WEMjBcDTFr6sZHuLoHKXehkMwVJMhVMWTdGTyvRf3tU4pfwuuePSkRrBQn75v7Lvv9CrmkgYX",
        "deployed_at": "2026-10-21T07:18:46Z",
        "atlas_pin": "fd2b8594031d56ae584301976e26f7348aaaea3a9900d2967201789f1b4e4ce9",
        "dd_wasm_sha256": "d7559c81a3e0c7d5d556a97cf0182d3958aa5c50a4e274bfe17e3c73c04f97dc"
      }
    },
    "knot-evm-root": {
      "layer": "duskevm",
      "id": "0xb165A687Cc5f6BBdA552Fb77c4b43A837699893e",
      "version": null,
      "tx": "0x3bdc7ead4e0ea815fae06c21e8e8578577d4beaa3871975f1aacfa4d3444930a",
      "at": "2026-10-28T16:55:25Z",
      "record": {
        "address": "0xb165A687Cc5f6BBdA552Fb77c4b43A837699893e",
        "deployed_block": 4014851,
        "deploy_tx": "0x3bdc7ead4e0ea815fae06c21e8e8578577d4beaa3871975f1aacfa4d3444930a",
        "deployer": "0xc11d5aAb4234E255E214aC6e8c0ad61FA0836473",
        "registry_id": "0x29db8e8eedd70bb42fe477131ca967069e2e641a0c0411ebf7f8ae2de0e9e731",
        "dusk_chain_id": 2,
        "messenger": "0x4200000000000000000000000000000000000007",
        "trusted_native_sender": "0xA0D14BdEe8572068F3b4AD349FD6cEDeA4a4B68a",
        "source_commit": "1bb260f"
      }
    }
  },
  "state": {
    "knot-proposals.init_registry": {
      "value": "29db8e8eedd70bb42fe477131ca967069e2e641a0c0411ebf7f8ae2de0e9e731",
      "since": "c926432cd70d3d5e122ffd2cdffa80bf83ee3d397515275db39ee38b16005e03",
      "at": "2026-10-28T15:15:30Z"
    },
    "knot-registry.init_data": {
      "value": "03734f3c300b75e81e79e4e497791ba794fb5537586ec8eb96d0191f634b8c82",
      "since": "c8e965a76c283de6e0fd3357b575aee5b13d0e7082a0d7d2f299b338a50da200",
      "at": "2026-10-28T14:31:50Z"
    },
    "knot-proposals.init_data": {
      "value": "d855030c4e3826fd035b99eaa63b028f1d0b936bd7491461c404f3f7feb54436",
      "since": "88b12bfffe8f14ee707634d04345ece742070aa0072a728b773adea468ef2709",
      "at": "2026-10-21T07:20:35Z"
    },
    "knot-registry.init_l1_messenger_contract": {
      "value": "63cd2c93016296b2ec357e31fd44b716cf2cda3b31217d45087f17ccc6440530",
      "since": "eaa89d10c2e29815a6a3b9d4fba5bdfd75ce222901a40100d779edbde36a571a",
      "at": "2026-10-28T14:55:30Z"
    },
    "knot-registry.init_evm_root_receiver": {
      "value": "b165a687cc5f6bbda552fb77c4b43a837699893e",
      "since": "c245cd911c84a3b6859beeff804bbfded4e144e58e3e418b7a0ca222e40d4c50",
      "at": "2026-10-28T17:02:29Z"
    },
    "knot-proposals.set_authorized_account": {
      "value": 0,
      "since": "d2fceec6147c0f1e4c26ae5988d8d7bfaf3b46b9eab966a0dd8c2ee2d7de6248",
      "at": "2026-10-28T17:05:29Z"
    },
    "alias.duskds.multisig-registry": {
      "value": "knot-registry",
      "since": null,
      "at": "2026-10-28T17:05:29Z"
    },
    "alias.duskds.multisig-proposals": {
      "value": "knot-proposals",
      "since": null,
      "at": "2026-10-28T17:05:29Z"
    }
  },
  "events": 66,
  "last_event": "577f98044a532af676c7e265c630226e715fa7612cc8756aabd71cc8c89e1177"
}
